<?xml version="1.0" encoding="utf-8"?>
<!DOCTYPE Alumnado SYSTEM "Alumnado.dtd">

<Alumnado>

    <alumnos>

        <alumno>
    
            <nif>57918411H</nif>
            <resultado>true</resultado>
            <observaciones></observaciones>
            <ipmac>ip</ipmac>
    
        </alumno>
    
        <alumno>
    
            <nif>98371531B</nif>
            <resultado>false</resultado>
            <observaciones>Ausencia prolongada.</observaciones>
            <ipmac>mac</ipmac>
    
        </alumno>
    
        <alumno>
    
            <nif>13896510E</nif>
            <resultado>true</resultado>
            <observaciones>Comportamiento ejemplar.</observaciones>
            <ipmac>mac</ipmac>
    
        </alumno>
    
    </alumnos>

</Alumnado>
